{
  "schemaVersion": 1,
  "packageId": "content-2edd664f020a8d163d679520",
  "version": 1,
  "createdAt": "2026-10-05T00:00:00.000Z",
  "supersedes": null,
  "packageStatus": "ELIGIBLE",
  "eligibleForPhase38": true,
  "libraryPresentation": {
    "description": "The ocean is the trading route for the planet.",
    "genre": "Business & Economics",
    "level": "B1",
    "readingTime": "Under 3 min",
    "imageReference": null
  },
  "content": {
    "recordId": "noaa-ocean-service-oceaneconomy",
    "title": "How important is the ocean to our economy?",
    "contentType": "expository",
    "contentGroup": "articles",
    "categories": {
      "primary": "business",
      "secondary": [
        "finance",
        "society"
      ]
    },
    "language": "en",
    "authors": [
      "NOAA"
    ],
    "reuseMode": "verified-full-text",
    "body": "The ocean is the trading route for the planet.\n\nThe U.S. economy is very dependent on healthy coastal and ocean resources. Consider the following facts:\n\nFourteen percent of U.S. counties that are adjacent to the coast produce 45 percent of the nation's gross domestic product (GDP), with over three million jobs (one in 45) directly dependent on the resources of the oceans and Great Lakes.\n\nIn 2017, the ocean economy, which includes six economic sectors that depend on the ocean and Great Lakes, contributed $307 billion to the U.S. GDP and supported 3.3 million jobs.\n\nTourism and recreation account for 73 percent of the ocean economy's total employment and 42 percent of its GDP. Offshore mineral extraction accounts for another 25 percent of the ocean economy's GDP.",
    "bodyReference": null
  },
  "source": {
    "sourceId": "noaa-ocean-service",
    "sourceName": "NOAA National Ocean Service",
    "sourceUrl": "https://oceanservice.noaa.gov/",
    "canonicalUrl": "https://oceanservice.noaa.gov/facts/oceaneconomy.html",
    "externalId": "oceaneconomy",
    "doi": null
  },
  "rights": {
    "verificationStatus": "verified",
    "permittedReuseMode": "verified-full-text",
    "rightsBasis": "public-domain",
    "sourcePolicy": {
      "rightsStatus": "verified",
      "maxReuseMode": "verified-full-text"
    },
    "license": {
      "type": null,
      "identifier": null,
      "url": null
    },
    "attributionRequired": true,
    "attributionText": "NOAA Ocean Service, oceanservice.noaa.gov",
    "evidence": [
      {
        "evidenceId": "noaa-ocean-service-oceaneconomy-metadata",
        "evidenceType": "item-metadata",
        "sourceUrl": "https://oceanservice.noaa.gov/facts/oceaneconomy.html",
        "reference": "Item metadata captured from the canonical source page.",
        "excerpt": null,
        "retrievedAt": "2026-10-05",
        "scope": "item",
        "appliesToRecordId": "noaa-ocean-service-oceaneconomy"
      },
      {
        "evidenceId": "noaa-ocean-service-oceaneconomy-item-rights",
        "evidenceType": "item-rights",
        "sourceUrl": "https://oceanservice.noaa.gov/disclaimer.html",
        "reference": "https://oceanservice.noaa.gov/disclaimer.html",
        "excerpt": "Information presented on this website is considered public information and may be distributed or copied, unless specifically noted otherwise. This website is maintained by NOAA’s National Ocean Service.",
        "retrievedAt": "2026-10-05",
        "scope": "item",
        "appliesToRecordId": "noaa-ocean-service-oceaneconomy"
      }
    ]
  },
  "validation": {
    "validator": "Phase 3.5 validateIntake",
    "result": "PASS",
    "errorCodes": []
  },
  "review": {
    "reviewStatus": "approved",
    "reviewer": "User (explicit request to import NOAA Ocean Service articles)",
    "decision": "The user explicitly authorized a real NOAA Ocean Service import batch. Each official oceanservice.noaa.gov page was fetched and its full text extracted verbatim, then reviewed individually for reuse rights and provenance: a NOAA author credit and citation date are required, and any copyright, third-party credit, courtesy/licence or restriction notice excludes the item. The official NOS disclaimer is recorded as source-policy evidence. No images or media are reused: imageReference is null for every item.",
    "reviewedAt": "2026-10-05T00:00:00.000Z"
  },
  "provenance": {
    "sourceRecordId": "noaa-ocean-service-oceaneconomy",
    "intakeRecordId": "noaa-ocean-service-oceaneconomy",
    "intakeSchemaVersion": "phase3.5-independent-intake-v1",
    "intakeValidationResult": "PASS",
    "dryRunResult": "PASS",
    "dryRunRecordId": "noaa-ocean-service-oceaneconomy",
    "reviewStatus": "approved",
    "packageCreatedAt": "2026-10-05T00:00:00.000Z",
    "sourceManifest": "research/phase4-6-noaa-ocean-service/intake/noaa-ocean-service-seafoam.json; research/phase4-6-noaa-ocean-service/intake/noaa-ocean-service-oceaneconomy.json; research/phase4-6-noaa-ocean-service/intake/noaa-ocean-service-lighthouse.json; research/phase4-6-noaa-ocean-service/intake/noaa-ocean-service-marheritage.json; research/phase4-6-noaa-ocean-service/intake/noaa-ocean-service-ocean-gliders.json; research/phase4-6-noaa-ocean-service/intake/noaa-ocean-service-lawofsea.json; research/phase4-6-noaa-ocean-service/intake/noaa-ocean-service-coral_medicine.json; research/phase4-6-noaa-ocean-service/intake/noaa-ocean-service-greenland-shark.json; research/phase4-6-noaa-ocean-service/intake/noaa-ocean-service-coral_bleach.json; research/phase4-6-noaa-ocean-service/intake/noaa-ocean-service-amoc.json"
  }
}
