{
  "schemaVersion": 1,
  "packageId": "content-dd8d6411c5deb06636031f16",
  "version": 1,
  "createdAt": "2026-10-04T02:31:52.985Z",
  "supersedes": null,
  "packageStatus": "ELIGIBLE",
  "eligibleForPhase38": true,
  "libraryPresentation": {
    "description": "Spring is an exciting time, but watching grass grow in any season is not something people want to be doing. Find out what it means when people say something is “like watching grass grow.”",
    "imageReference": null,
    "level": "B1",
    "genre": "Society",
    "readingTime": "Under 3 min"
  },
  "content": {
    "recordId": "voa-learning-english-8003108",
    "title": "'Watching the Grass Grow' Is Not Fun",
    "contentType": "educational",
    "contentGroup": "articles",
    "categories": {
      "primary": "language-learning",
      "secondary": []
    },
    "language": "en",
    "authors": [
      "Anna Matteo (VOA Learning English)"
    ],
    "reuseMode": "verified-full-text",
    "body": "And now Words and Their Stories from VOA Learning English.\n\nSpringtime is a time of renewal and growth. Many plants end their long winter sleep and form new buds and shoots. Beautiful flowers will soon be showing their bright colors. And the grass will grow thicker and greener again.\n\nSome flowers bloom in a very noticeable way but that is not the case with grass. Imagine you are sitting in a grassy field. And you have only one job – to watch the grass grow. That does not sound very interesting. In fact, it sounds really boring.\n\nThat idea is what gives us the expression “like watching grass grow.” We use this expression to describe an experience that is uninteresting. Another good word to describe it is “tedious.”\n\nWe use this expression in many situations. Let’s hear a few examples:\n\n“After the politician won his campaign, he gave a two-hour long acceptance speech. Two hours! It was as much fun as watching grass grow.”\n\n“I really don’t like watching long sports games. It’s like watching grass grow.”\n\nNow, grass grows on the ground all the time. And usually, we don’t give it much thought. If you stand in one place for a long time, the grass will continue to grow under your feet.\n\nFor people who are always active, always moving, always on-the-go, we can say they don't let grass grow under their feet. We can also say beneath their feet. And sometimes we use this expression as a command.\n\nLet’s hear some examples:\n\n“Don’t let the grass grow beneath your feet. Get back to work.”\n\n“She certainly doesn’t let the grass grow under her feet. She’s been traveling non-stop for over a year.”\n\nAnd that’s all the time we have for this Words and Their Stories. Until next time, I’m Anna Matteo.\n\nAnna Matteo wrote this story for VOA Learning English.\n\nWords in This Story\n\nbud – n. the beginnings of a flower or a leaf on the branch of a plant\n\nshoot – n. new plant growth, especially from seeds or close to the ground as in the case with grass\n\nbloom – v. the opening of a flower\n\nboring – adj. not interesting\ntedious – adj. tiresome because it takes a long time and is repetitive\n\non-the-go – phrase having much high-spirited energy and movement",
    "bodyReference": null
  },
  "source": {
    "sourceId": "voa-learning-english",
    "sourceName": "VOA Learning English",
    "sourceUrl": "https://learningenglish.voanews.com/",
    "canonicalUrl": "https://learningenglish.voanews.com/a/watching-the-grass-grow-is-not-fun/8003108.html",
    "externalId": "8003108",
    "doi": null
  },
  "rights": {
    "verificationStatus": "verified",
    "permittedReuseMode": "verified-full-text",
    "rightsBasis": "conditional-source-policy",
    "sourcePolicy": {
      "rightsStatus": "partially-verified",
      "maxReuseMode": "metadata-only"
    },
    "license": {
      "type": null,
      "identifier": null,
      "url": null
    },
    "attributionRequired": true,
    "attributionText": "Credit to learningenglish.voanews.com",
    "evidence": [
      {
        "evidenceId": "voa-learning-english-8003108-metadata",
        "evidenceType": "item-metadata",
        "sourceUrl": "https://learningenglish.voanews.com/a/watching-the-grass-grow-is-not-fun/8003108.html",
        "reference": "Item metadata captured from the canonical source page.",
        "excerpt": null,
        "retrievedAt": "2026-10-04",
        "scope": "item",
        "appliesToRecordId": "voa-learning-english-8003108"
      },
      {
        "evidenceId": "voa-learning-english-8003108-source-policy",
        "evidenceType": "source-policy",
        "sourceUrl": "https://learningenglish.voanews.com/p/6861.html",
        "reference": "https://learningenglish.voanews.com/p/6861.html",
        "excerpt": "Learning English texts, MP3s, photos and videos are in the public domain. You are allowed to reprint them for educational and commercial purposes, with credit to learningenglish.voanews.com. However, stories, photos and video images from news agencies such as AP, Reuters and AFP are copyrighted, so you are not allowed to republish them.",
        "retrievedAt": "2026-10-04",
        "scope": "source",
        "appliesToRecordId": "voa-learning-english"
      }
    ]
  },
  "validation": {
    "validator": "Phase 3.5 validateIntake",
    "result": "PASS",
    "errorCodes": []
  },
  "review": {
    "reviewStatus": "approved",
    "reviewedAt": "2026-10-04T02:31:52.985Z",
    "reviewer": "User (explicit production import request)",
    "decision": "The user explicitly authorized production import of exactly this article, conditional on all validation gates passing. The item-specific VOA author credit, full article text, required attribution, and official rights policy were reviewed."
  },
  "provenance": {
    "sourceRecordId": "voa-learning-english-8003108",
    "intakeRecordId": "voa-learning-english-8003108",
    "intakeSchemaVersion": "phase3.5-independent-intake-v1",
    "intakeValidationResult": "PASS",
    "dryRunResult": "PASS",
    "dryRunRecordId": "voa-learning-english-8003108",
    "reviewStatus": "approved",
    "packageCreatedAt": "2026-10-04T02:31:52.985Z",
    "sourceManifest": "research/phase4-1-voa-first-import/intake/voa-learning-english-8003108.json"
  }
}
