{
  "schemaVersion": 1,
  "packageId": "content-220b2c374f1a2c425b543c30",
  "version": 1,
  "createdAt": "2026-10-04T03:01:01.620Z",
  "supersedes": null,
  "packageStatus": "ELIGIBLE",
  "eligibleForPhase38": true,
  "libraryPresentation": {
    "description": "This week on Words and Their Stories, we find out about expressions to describe when two people have a lot of similarities or are very close. They might work together. But do not read too much into that.",
    "imageReference": null,
    "level": "B1",
    "genre": "Society",
    "readingTime": "Under 3 min"
  },
  "content": {
    "recordId": "voa-learning-english-7963076",
    "title": "What Does It Take to Be a 'Power Couple'?",
    "contentType": "educational",
    "contentGroup": "articles",
    "categories": {
      "primary": "language-learning",
      "secondary": [
        "society"
      ]
    },
    "language": "en",
    "authors": [
      "Anna Matteo wrote this story for VOA Learning English"
    ],
    "reuseMode": "verified-full-text",
    "body": "And now, Words and Their Stories, from VOA Learning English.\n\nIn American English, we use many expressions to describe when two people have a lot of similarities or are very close. Here are some examples.\n\nIf we say two people are joined at the hip, they are nearly always together. If we describe individuals as thick as thieves, it means they are very close. People considered two peas in a pod have many things in common. And we use the term kindred spirits to describe people who often share the same opinions and interests.\n\nThese expressions can represent people who grew closer for different reasons. Maybe they complemented each other well in certain ways. Or maybe their situations brought them together for the purpose of completing something important or meaningful.\n\nBut today we are going to discuss a very special kind of relationship – one that involves two people who are romantically involved and very successful.\n\nPeople in such relationships can be described as power couples.\n\nThere are many examples of famous power couples, including successful movie stars, musicians and others in the performing arts. But power couples can exist in many other industries and communities, as well. And, the two people do not have to work in the same industry.\n\nIf they do, however, that can make them even more powerful. For example, a well-known architect who builds homes could be partnered with a famous designer who decorates them. Or, one person in a power couple may be a music producer, while the other is a famous singer.\n\nEven though power couples involve highly successful people, one person could describe their partner as their better half. This is a way to compliment their “other half” in the relationship. For example, one might say during a meeting with a friend, “Hello! How are you? And more importantly, how is your better half?”\n\nNow, let’s hear two friends use some of these expressions.\n\nA: Hey, I’m not used to seeing you alone. Where’s your sidekick?\n\nB: Huh? Who are you talking about?\n\nA: Ben. You guys have been joined at the hip for weeks. Looks like you’re thick as thieves.\n\nB: Well, the project is pretty important for the company. So, we’re putting in a lot of hours.\n\nA: Are you becoming kindred spirits from working so much together?\n\nB: No. It’s just keeping us both very busy.\n\nA: Busy trying to become the new power couple in the office?\n\nB: What are you talking about? We’re not thick as thieves or kindred spirits, and we’re definitely not a power couple. We are just working hard on the same project!\n\nAnd that’s all the time we have for this Words and Their Stories. Until next time, I’m Anna Matteo.\n\nAnna Matteo wrote this story for VOA Learning English.\n\nWords in This Story\n\ncomplement – n. something that fills up, completes, or makes better or perfect; v. to complete or enhance by providing something additional\n\nromantically – adv. done in a way that relates or is associated with love; romantic – of, relating to, or associated with love\n\narchitect – n. a person who designs buildings and advises in their construction\n\ndecorate – v. to make more attractive by adding something that is beautiful or becoming\n\ncompliment – n. an expression of respect, affection, or admiration; v. to make an expression of respect, affection, or admiration\n\nsidekick – n. a person closely associated with another as a subordinate or partner",
    "bodyReference": null
  },
  "source": {
    "sourceId": "voa-learning-english",
    "sourceName": "VOA Learning English",
    "sourceUrl": "https://learningenglish.voanews.com/",
    "canonicalUrl": "https://learningenglish.voanews.com/a/what-does-it-take-to-be-a-power-couple-/7963076.html",
    "externalId": "7963076",
    "doi": null
  },
  "rights": {
    "verificationStatus": "verified",
    "permittedReuseMode": "verified-full-text",
    "rightsBasis": "conditional-source-policy",
    "sourcePolicy": {
      "rightsStatus": "partially-verified",
      "maxReuseMode": "metadata-only"
    },
    "license": {
      "type": null,
      "identifier": null,
      "url": null
    },
    "attributionRequired": true,
    "attributionText": "Credit to learningenglish.voanews.com",
    "evidence": [
      {
        "evidenceId": "voa-learning-english-7963076-metadata",
        "evidenceType": "item-metadata",
        "sourceUrl": "https://learningenglish.voanews.com/a/what-does-it-take-to-be-a-power-couple-/7963076.html",
        "reference": "Item metadata captured from the canonical source page.",
        "excerpt": null,
        "retrievedAt": "2026-10-04",
        "scope": "item",
        "appliesToRecordId": "voa-learning-english-7963076"
      },
      {
        "evidenceId": "voa-learning-english-7963076-source-policy",
        "evidenceType": "source-policy",
        "sourceUrl": "https://learningenglish.voanews.com/p/6861.html",
        "reference": "https://learningenglish.voanews.com/p/6861.html",
        "excerpt": "Learning English texts, MP3s, photos and videos are in the public domain. You are allowed to reprint them for educational and commercial purposes, with credit to learningenglish.voanews.com. However, stories, photos and video images from news agencies such as AP, Reuters and AFP are copyrighted, so you are not allowed to republish them.",
        "retrievedAt": "2026-10-04",
        "scope": "source",
        "appliesToRecordId": "voa-learning-english"
      }
    ]
  },
  "validation": {
    "validator": "Phase 3.5 validateIntake",
    "result": "PASS",
    "errorCodes": []
  },
  "review": {
    "reviewStatus": "approved",
    "reviewedAt": "2026-10-04T03:01:01.620Z",
    "reviewer": "User (explicit request to import five articles)",
    "decision": "The user explicitly authorized importing up to five new VOA Learning English articles subject to every existing rights, validation, approval, duplicate, and provenance gate passing. The official source pages and full article text were inspected; unverified third-party media was excluded."
  },
  "provenance": {
    "sourceRecordId": "voa-learning-english-7963076",
    "intakeRecordId": "voa-learning-english-7963076",
    "intakeSchemaVersion": "phase3.5-independent-intake-v1",
    "intakeValidationResult": "PASS",
    "dryRunResult": "PASS",
    "dryRunRecordId": "voa-learning-english-7963076",
    "reviewStatus": "approved",
    "packageCreatedAt": "2026-10-04T03:01:01.620Z",
    "sourceManifest": "research/phase4-1-voa-first-import/intake/voa-learning-english-3947928.json; research/phase4-1-voa-first-import/intake/voa-learning-english-7979814.json; research/phase4-1-voa-first-import/intake/voa-learning-english-7940837.json; research/phase4-1-voa-first-import/intake/voa-learning-english-7963076.json; research/phase4-1-voa-first-import/intake/voa-learning-english-7980848.json"
  }
}
