{
  "schemaVersion": 1,
  "packageId": "content-7f0ded3926404f7cdcca90bb",
  "version": 1,
  "createdAt": "2026-10-04T02:42:47.054Z",
  "supersedes": null,
  "packageStatus": "ELIGIBLE",
  "eligibleForPhase38": true,
  "libraryPresentation": {
    "description": "Wilbur and Orville Wright quietly developed a powered flying machine that proved heavier-than-air flight was possible more than 120 years ago.",
    "imageReference": null,
    "level": "B1",
    "genre": "Science",
    "readingTime": "Under 3 min"
  },
  "content": {
    "recordId": "voa-learning-english-7998765",
    "title": "Wilbur and Orville Wright: The First Airplane",
    "contentType": "educational",
    "contentGroup": "articles",
    "categories": {
      "primary": "science",
      "secondary": [
        "history",
        "technology"
      ]
    },
    "language": "en",
    "authors": [
      "Marilyn Rice Christiano wrote this story for VOA Learning English",
      "John Russell adapted it"
    ],
    "reuseMode": "verified-full-text",
    "body": "Wilbur and Orville Wright are the American inventors who made a small engine-powered flying machine. They proved that flight without the aid of gas-filled balloons was possible.\n\nWilbur Wright was born in 1867 near Melville, Indiana. His brother Orville was born four years later in Dayton, Ohio.\n\nAs they grew up, the Wright brothers experimented with mechanical things. Later, the Wright brothers began to design their own flying machine. They used ideas they had developed from earlier experiments with a toy helicopter, kites, the printing machine and bicycles.\n\nSoon, they needed a place to test their ideas about flight. The best place with the best wind conditions seemed to be a piece of sandy land in North Carolina along the coast of the Atlantic Ocean. It was called Kill Devil Hill, near the town of Kitty Hawk.\n\nThe Wright brothers did many tests with gliders at Kitty Hawk. With these tests, they learned how to solve many problems.\n\nBy the autumn of 1903, Wilbur and Orville had designed and built an airplane powered by a gasoline engine. The plane had wings 12 meters across. It weighed about 340 kilograms, including the pilot.\n\nOn December 17th, 1903, they made the world's first flight in a machine that was heavier than air and powered by an engine. Orville flew the plane 36 meters. He was in the air for 12 seconds. The two brothers made three more flights that day.\n\nFour other men watched the Wright brothers' first flights. One of the men took pictures. Few newspapers, however, noted the event.\n\nIt was almost five years before the Wright brothers became famous. In 1908, Wilbur went to France. He gave demonstration flights at heights of 90 meters. A French company agreed to begin making the Wright brothers' flying machine.\n\nOrville made successful flights in the United States at the time Wilbur was in France. The United States War Department agreed to buy a Wright brothers' plane. Wilbur and Orville suddenly became world heroes. But the brothers were not seeking fame. They returned to Dayton where they continued to improve their airplanes. They taught many others how to fly.\n\nWilbur Wright died of typhoid fever in 1912. Orville Wright continued designing and inventing until he died many years later, in 1948.\n\nToday, the Wright brothers' first airplane is in the Air and Space Museum in Washington, D.C. Visitors to the museum can look at the Wright brothers' small plane. Then they can walk to another area and see space vehicles and a rock collected from the moon. The world has changed a lot since Wilbur and Orville Wright began the modern age of flight over one hundred years ago.\n\nI’m John Russell.\n\nMarilyn Rice Christiano wrote this story for VOA Learning English. John Russell adapted it.\n\nWords in This Story\n\nglider – n. a flying object similar to an airplane but without an engine",
    "bodyReference": null
  },
  "source": {
    "sourceId": "voa-learning-english",
    "sourceName": "VOA Learning English",
    "sourceUrl": "https://learningenglish.voanews.com/",
    "canonicalUrl": "https://learningenglish.voanews.com/a/wilbur-and-orville-wright-the-first-airplane/7998765.html",
    "externalId": "7998765",
    "doi": null
  },
  "rights": {
    "verificationStatus": "verified",
    "permittedReuseMode": "verified-full-text",
    "rightsBasis": "conditional-source-policy",
    "sourcePolicy": {
      "rightsStatus": "partially-verified",
      "maxReuseMode": "metadata-only"
    },
    "license": {
      "type": null,
      "identifier": null,
      "url": null
    },
    "attributionRequired": true,
    "attributionText": "Credit to learningenglish.voanews.com",
    "evidence": [
      {
        "evidenceId": "voa-learning-english-7998765-metadata",
        "evidenceType": "item-metadata",
        "sourceUrl": "https://learningenglish.voanews.com/a/wilbur-and-orville-wright-the-first-airplane/7998765.html",
        "reference": "Item metadata captured from the canonical source page.",
        "excerpt": null,
        "retrievedAt": "2026-10-04",
        "scope": "item",
        "appliesToRecordId": "voa-learning-english-7998765"
      },
      {
        "evidenceId": "voa-learning-english-7998765-source-policy",
        "evidenceType": "source-policy",
        "sourceUrl": "https://learningenglish.voanews.com/p/6861.html",
        "reference": "https://learningenglish.voanews.com/p/6861.html",
        "excerpt": "Learning English texts, MP3s, photos and videos are in the public domain. You are allowed to reprint them for educational and commercial purposes, with credit to learningenglish.voanews.com. However, stories, photos and video images from news agencies such as AP, Reuters and AFP are copyrighted, so you are not allowed to republish them.",
        "retrievedAt": "2026-10-04",
        "scope": "source",
        "appliesToRecordId": "voa-learning-english"
      }
    ]
  },
  "validation": {
    "validator": "Phase 3.5 validateIntake",
    "result": "PASS",
    "errorCodes": []
  },
  "review": {
    "reviewStatus": "approved",
    "reviewedAt": "2026-10-04T02:42:47.054Z",
    "reviewer": "User (explicit request to import two articles)",
    "decision": "The user explicitly authorized importing two real VOA Learning English articles after all pipeline and rights gates pass. The original source page, byline, full text, required attribution, and third-party content exclusions were reviewed."
  },
  "provenance": {
    "sourceRecordId": "voa-learning-english-7998765",
    "intakeRecordId": "voa-learning-english-7998765",
    "intakeSchemaVersion": "phase3.5-independent-intake-v1",
    "intakeValidationResult": "PASS",
    "dryRunResult": "PASS",
    "dryRunRecordId": "voa-learning-english-7998765",
    "reviewStatus": "approved",
    "packageCreatedAt": "2026-10-04T02:42:47.054Z",
    "sourceManifest": "research/phase4-1-voa-first-import/intake/voa-learning-english-7990415.json; research/phase4-1-voa-first-import/intake/voa-learning-english-7998765.json"
  }
}
